item_id,restaurent_name,item_name,description,cuisine,category,is_morning,is_afternoon,is_evening,is_sunny,is_rainy,portion_size,price
1,Grand Seven,Crab Toast,Crispy bread triangles topped with crab mixer & Parmesan cheese.,Continental,Starter,1,1,1,0,1,,1375
2,Grand Seven,Cheese Toast,Crispy bread triangles  topped with cheese & green chilies.,Continental,Starter,1,1,1,0,1,,1375
3,Grand Seven,Prawn Cocktail,Boiled medium prawns on a bed of lettuce with lime wedge and cocktail sauce.,Continental,Starter,0,1,1,1,0,,1400
4,Grand Seven,Sea Food Cocktail,"Diced fish, shrimp, cuttlefish served with parsley, tomatoes on bed of lettuce cocktail sauce.",Continental,Starter,0,1,1,1,0,,1400
5,Grand Seven,Mixed Vegetable Cocktail,Diced vegetable light cocktail sauce served on bed of lettuce.,Continental,Starter,0,1,1,1,0,,1350
6,Grand Seven,Chicken Mulligatawny,"Traditional Indian soup garnished with boiled rice, fried onion and a lime wedge.",Indian,Soup,0,1,1,1,0,,1175
7,Grand Seven,Cream Of Spinach,Made with fresh garden spinach.,Continental,Soup,0,1,1,1,0,,1175
8,Grand Seven,Cream Of Tomato,Made with fresh garam tomato.,Continental,Soup,0,1,1,1,0,,1175
9,Grand Seven,Cream Of Mushrooom,Creamy mushroom soup with sliced mushroom.,Continental,Soup,0,1,1,1,0,,1175
10,Grand Seven,Cream Of Vegetable,Creamy vegetable with diced vegetable.,Continental,Soup,0,1,1,1,0,,1125
11,Grand Seven,Cream Of Chicken,Creamy chicken soup with diced chicken.,Continental,Soup,0,1,1,1,0,,1175
12,Grand Seven,Smoked Chicken And Apple Salad,Bound with yogurt and peanut dressing.,Continental,Salad,1,1,1,1,0,,1400
13,Grand Seven,Caesar Salad,"Lettuce tossed with egg, anchovies, bacon, parmesan cheese, croutons and a creamy dressing.",Continental,Salad,1,1,1,1,0,,1400
14,Grand Seven,Chicken Caesar Salad,As above Caesar with grilled chicken strips.,Continental,Salad,1,1,1,1,0,,1475
15,Grand Seven,Chef Salad,"Lettuce, ham, beef, cheese, tuna, thousand island or sundried chilly mayonnaise mixed dressing.",Continental,Salad,1,1,1,1,0,,1425
16,Grand Seven,Mediterranean Tuna Salad,"Fresh tuna fillet with potato, green beans, tomato, onions, olives & boiled eggs toasted in mustard vinaigrette.",Mediterranean,Salad,1,1,1,1,0,,1400
17,Grand Seven,Russian Salad,Boiled assorted vegetables mixed mayonnaise sauce & dressing.,Continental,Salad,1,1,1,1,0,,1350
18,Grand Seven,Stir Fry Vegetables,Stir-fry vegetables served with rice.,Asian,Main,0,1,1,1,0,,1400
19,Grand Seven,Vegetable Tempura,"Thick sliced mixed vegetables, deep fried battered in tempura served with spicy green chili sauce.",Asian,Main,0,1,1,1,0,,1250
20,Grand Seven,Vegetable Platter,Batter fried mushroom & sautÃ© vegetable served with mashed potato or rice.,Continental,Main,0,1,1,1,0,,1300
21,Grand Seven,Prawn Napolitana,SautÃ© medium prawns mixed with Italian style tomato cream sauce served on bed of spaghetti with parmesan cheese & garlic bread.,Italian,Main,0,1,1,0,1,,1750
22,Grand Seven,Chicken Cacciatore,Herb flavored chicken cooked with garden vegetables and tomato sauce served on bed of spaghetti with parmesan cheese & garlic bread.,Italian,Main,0,1,1,0,1,,1625
23,Grand Seven,Chicken Ala Carbonara,"Spaghetti tossed in boneless chicken or beef mixed with thick creamy sauce, mushroom and egg yolk served with parmesan cheese & garlic bread.",Italian,Main,0,1,1,0,1,,1625
24,Grand Seven,Bolognaise,Spaghetti with minced meat sauce.,Italian,Main,0,1,1,0,1,,1625
25,Grand Seven,Beef Stroganoff,Beef fillet with mushroom and served with pasta gravy sauce.,Continental,Main,0,1,1,0,1,,1650
26,Grand Seven,Sea Food Macaroni,Diced sea food macaroni with cream sauce & cheese.,Italian,Main,0,1,1,0,1,,1750
27,Grand Seven,Chicken In A Basket,Crumb fried supreme of chicken with paprika tartar sauce.,Continental,Main,0,1,1,0,1,,1650
28,Grand Seven,Chicken Coq Au Vin,"Mushroom, onion, pepper and chicken with white wine and demi-glazed sauce served with rice and salad.",French,Main,0,1,1,0,1,,1575
29,Grand Seven,Chilli Chicken,Spicy boneless chicken served with rice and salad.,Asian,Main,0,1,1,1,0,,1575
30,Grand Seven,Chicken Cordon Bleu,"Crumb fried chicken breast stuffed with chicken ham & cheese served with mixed salad, French fries and white mushroom sauce.",French,Main,0,1,1,0,1,,1700
31,Grand Seven,Chicken Kiev,"Crumb fry chicken breast topped with melted cheese, parmesan gratinated asparagus & French fries.",Continental,Main,0,1,1,0,1,,1650
32,Grand Seven,Grilled Chicken Bockwurst,"Grilled chicken bockwurst served with mashed potato, carrots, onion & gravy.",Continental,Main,0,1,1,0,1,,1575
33,Grand Seven,Roasted Chicken,"Roasted chicken served with roasted potato, coleslaw salad & red wine sauce.",Continental,Main,0,1,1,0,1,,2600
35,Grand Seven,Vegetable Noodles,,Chinese,Main,0,1,1,1,0,2 Person,1400
37,Grand Seven,Chicken Noodles,,Chinese,Main,0,1,1,1,0,2 Person,1575
39,Grand Seven,Beef Noodles,,Chinese,Main,0,1,1,1,0,2 Person,1600
41,Grand Seven,Pork Noodles,,Chinese,Main,0,1,1,1,0,2 Person,1600
43,Grand Seven,Fish Noodles,,Chinese,Main,0,1,1,1,0,2 Person,1650
45,Grand Seven,Prawn Noodles,,Chinese,Main,0,1,1,1,0,2 Person,1700
47,Grand Seven,Sea Food Noodles,,Chinese,Main,0,1,1,1,0,2 Person,1700
49,Grand Seven,Mixed Noodles,,Chinese,Main,0,1,1,1,0,2 Person,1650
51,Grand Seven,Crispy Noodles With Sea Food,,Chinese,Main,0,1,1,1,0,2 Person,1750
53,Grand Seven,Crispy Noodles With Mixed Meat,,Chinese,Main,0,1,1,1,0,2 Person,1700
55,Grand Seven,"Hong Kong Fried Noodles - Vermicelli Sea Food, Mixed Meat",,Chinese,Main,0,1,1,1,0,2 Person,1750
57,Grand Seven,Vegetable Kottu,,Sri Lankan,Main,0,1,1,1,0,,925
58,Grand Seven,Cheese Kottu,,Sri Lankan,Main,0,1,1,1,0,,1100
59,Grand Seven,Chicken / Beef / Pork Kottu,,Sri Lankan,Main,0,1,1,1,0,,2050
60,Grand Seven,Sea Food Kottu,,Sri Lankan,Main,0,1,1,1,0,,1200
61,Grand Seven,Mutton Kottu,,Sri Lankan,Main,0,1,1,1,0,,1275
62,Grand Seven,Vegetable Set Lunch,"Vegetable Fried Rice, Kangkung with Garlic, Vegetable Chopsuey, Devilled Mushroom",Asian,Main,0,1,1,1,0,,900
63,Grand Seven,Chicken Set Lunch,"Vegetable Fried Rice, Devilled Chicken, Vegetable Chopsuey, Chilli Paste",Asian,Main,0,1,1,1,0,,1050
64,Grand Seven,Beef or Pork Set Lunch,"Vegetable Fried Rice, Devilled Pork or Beef, Vegetable Chopsuey, Chilli Paste",Asian,Main,0,1,1,1,0,,1100
65,Grand Seven,Sea Food Set Lunch,"Vegetable Fried Rice, Devilled Fish or Prawns or Cuttle Fish, Vegetable Chopsuey, Chilli Paste",Asian,Main,0,1,1,1,0,,1150
66,Grand Seven,Deep Fried Prawn Ball,,Chinese,Starter,0,1,1,1,0,,1000
67,Grand Seven,Deep Fried Cuttle Fish Thai Style,,Chinese,Starter,0,1,1,1,0,2 Person,1400
69,Grand Seven,Deep Fried Chicken Wing,,Chinese,Starter,0,1,1,1,0,2 Person,1050
71,Grand Seven,Spring Roll Vegetable,,Chinese,Starter,1,1,1,1,0,2 Person,1155
73,Grand Seven,Spring Roll Chicken,,Chinese,Starter,1,1,1,1,0,2 Person,1250
75,Grand Seven,Assorted Dish,"Prawns, Toast Fried Wonton, Chicken Wing, Spring Roll",Chinese,Starter,0,1,1,1,0,2 Person,2050
77,Grand Seven,Salad Spring Roll,,Chinese,Starter,1,1,1,1,0,,1125
78,Grand Seven,Prawn Spring Roll,,Chinese,Starter,0,1,1,1,0,,1150
79,Grand Seven,Prawn Toast,,Chinese,Starter,0,1,1,1,0,,1150
80,Grand Seven,Fried Wonton,,Chinese,Starter,0,1,1,1,0,,1150
81,Grand Seven,Chicken & Sweet Corn Soup,,Chinese,Soup,0,1,1,0,1,2 Person,1375
83,Grand Seven,Crab Meat & Sweet Corn Soup,,Chinese,Soup,0,1,1,0,1,2 Person,1450
85,Grand Seven,Vegetable Soup,,Chinese,Soup,0,1,1,0,1,2 Person,1350
87,Grand Seven,Coriander Leaves with Sea Food Soup,,Chinese,Soup,0,1,1,0,1,2 Person,1350
89,Grand Seven,Vegetable Hot & Sour Soup,,Chinese,Soup,0,1,1,0,1,2 Person,975
91,Grand Seven,Tom Yum Soup,,Thai,Soup,0,1,1,0,1,2 Person,1350
93,Grand Seven,Sea Food with Bean Curd Soup,,Chinese,Soup,0,1,1,0,1,2 Person,1500
95,Grand Seven,Wonton Soup - Clear Soup,,Chinese,Soup,0,1,1,0,1,2 Person,1250
97,Grand Seven,Chicken Hot and Sour Soup,,Chinese,Soup,0,1,1,0,1,2 Person,1325
99,Grand Seven,Tomato and Egg Soup,,Chinese,Soup,0,1,1,0,1,2 Person,1225
101,Grand Seven,Fried Chilli Pork,,Chinese,Main,0,1,1,1,0,,1500
103,Grand Seven,Shredded Pork with Garlic Sauce,,Chinese,Main,0,1,1,1,0,,1500
104,Grand Seven,Baked Pork in Spicy Salt - Pork Chop,,Chinese,Main,0,1,1,1,0,,1500
105,Grand Seven,Devilled or Fried Pork,,Chinese,Main,0,1,1,1,0,,1575
106,Grand Seven,Fried Beef Slice with Oyster Sauce,,Chinese,Main,0,1,1,1,0,,1755
107,Grand Seven,Beef with Dry Red Chilli,,Chinese,Main,0,1,1,1,0,,1575
108,Grand Seven,Devilled or Fried Beef,,Chinese,Main,0,1,1,1,0,,1575
109,Grand Seven,Beef with Ginger & Spring Onion,,Chinese,Main,0,1,1,1,0,,1755
110,Grand Seven,Pepper Pork,,Chinese,Main,0,1,1,1,0,,1500
111,Grand Seven,Black Bean Pork,,Chinese,Main,0,1,1,1,0,,1500
112,Grand Seven,Fried Pork in Hot Garlic Sauce,,Chinese,Main,0,1,1,1,0,,1500
113,Grand Seven,Mutton Stew,,Chinese,Main,0,1,1,0,1,,2650
114,Grand Seven,Pepper Lamb,,Chinese,Main,0,1,1,1,0,,2200
115,Grand Seven,Pepper Lamb - Large,,Chinese,Main,0,1,1,1,0,,2750
116,Grand Seven,Sea Food Platter,"Battered prawns and cuttlefish, grilled seer, baked or chili crab served with French fries, coleslaw & tartar sauce.",Continental,Main,0,1,1,0,1,,3250
117,Grand Seven,Pub Battered Prawns,Crispy & tender golden color battered fry medium prawns served with coleslaw & tartar sauce.,Continental,Main,0,1,1,0,1,,1900
118,Grand Seven,Baked or Chili Crab,"Export quality crab meat cooked with bechamel sauce, mixed cheese, and chef's special seafood sauce, and cheese served with rice & green salad.",Continental,Main,0,1,1,0,1,,1900
119,Grand Seven,Spicy or Hot Garlic Prawns,"Medium size prawns mixed with chef's special garlic, ginger, oyster sauce served with rice and green salad.",Continental,Main,0,1,1,0,1,,1950
120,Grand Seven,Darne of Seer or Crispy Seer,"Grilled or crispy fried seer served with rice, veggies & a light tartar sauce.",Continental,Main,0,1,1,0,1,,1950
121,Grand Seven,Grilled Lobster,Grilled lobster with lemon garlic butter sauce served with French fries & coleslaw salad.,Continental,Main,0,1,1,0,1,,1950
122,Grand Seven,Tender Cuttlefish with Spicy Thai Sauce,Tender cuttlefish cooked with spicy Thai sauce served with rice & green salad.,Thai,Main,0,1,1,0,1,,1950
123,Grand Seven,Fish & Chips,"Crumb fried white fish fillet served with coleslaw, French fries & tartar sauce.",Continental,Main,0,1,1,0,1,,1950
124,Grand Seven,Fish Ala Crill,Batter fried fish fillet with tomato sauce or tartar sauce served with French fries and coleslaw salad.,Continental,Main,0,1,1,0,1,,1850
125,Grand Seven,Lean Pork,Served with French fries or rice or fettuccine with coleslaw and mustard sauce.,Continental,Main,0,1,1,0,1,,2250
126,Grand Seven,Roasted or Grilled Pork Knuckle,Served with French fries or mashed potato with coleslaw salad & mustard sauce.,Continental,Main,0,1,1,0,1,,2250
127,Grand Seven,Pork Schnitzel,Pan fried pork fillet served with mashed potato and green cucumber salad.,Continental,Main,0,1,1,0,1,,2150
128,Grand Seven,Stir Fry Pork with Vegetable,Filled pork saute with garlic and vegetable served with rice or noodles.,Asian,Main,0,1,1,1,0,,1900
129,Grand Seven,Pork Mustard,Lightly spicy mustard pork served with rice and salad.,Continental,Main,0,1,1,0,1,,1775
130,Grand Seven,Pot of Tea or Coffee,,Continental,Beverage,1,1,1,1,0,3 Person,850
131,Grand Seven,Milk Shake,Vanilla or chocolate or strawberry,Continental,Beverage,1,1,1,1,0,,600
132,Grand Seven,Cup of Tea or Coffee,,Continental,Beverage,1,1,1,1,0,,400
133,Grand Seven,Ice Coffee,,Continental,Beverage,1,1,1,1,0,,450
134,Grand Seven,Orange Juice,,Continental,Beverage,1,1,1,1,0,,575
135,Grand Seven,Pineapple Juice,,Continental,Beverage,1,1,1,1,0,,575
136,Grand Seven,Papaya Juice,,Continental,Beverage,1,1,1,1,0,,575
137,Grand Seven,Mango Juice,,Continental,Beverage,1,1,1,1,0,,625
138,Grand Seven,Watermelon Juice,,Continental,Beverage,1,1,1,1,0,,575
139,Grand Seven,Mixed Fruit Juice,,Continental,Beverage,1,1,1,1,0,,625
140,Grand Seven,Fresh Lime Juice,,Continental,Beverage,1,1,1,1,0,,525
141,Grand Seven,Lime with Soda,,Continental,Beverage,1,1,1,1,0,,550
142,Grand Seven,Coke,,Continental,Beverage,1,1,1,1,0,,250
143,Grand Seven,Sprite,,Continental,Beverage,1,1,1,1,0,,250
144,Grand Seven,Ginger Beer,,Continental,Beverage,1,1,1,1,0,,250
145,Grand Seven,Soda,,Continental,Beverage,1,1,1,1,0,,230
146,Grand Seven,Mineral Water,,Continental,Beverage,1,1,1,1,0,,220
147,Grand Seven,Lamb Chop,"Imported lamb chop marinated & grilled with herbs served with herb rice, green salad and fresh mint sauce.",Continental,Main,0,1,1,0,1,,3200
148,Grand Seven,Pork Chop,"Grilled pork chop with mustard sauce, boiled vegetable or salad served with grilled pineapple and French fries.",Continental,Main,0,1,1,0,1,,2175
149,Grand Seven,Mixed Grill,"Beef fillet, chicken, pork, mushroom, sausage, egg served with French fries, coleslaw salad & BBQ sauce.",Continental,Main,0,1,1,0,1,,3350
150,Grand Seven,Pepper Steak,"Grilled marinated tenderloin steak served with grilled potato, coleslaw salad, French fries and BBQ sauce.",Continental,Main,0,1,1,0,1,,2400
151,Grand Seven,Kebab - Chicken/Beef/Pork/Fish,"Grilled beef/chicken/pork/fish, tomato & cucumber served with yellow rice, salad & peanut sauce.",Asian,Main,0,1,1,0,1,,2050
152,Grand Seven,Grand 7 Special Rice Dish,"Mixed fried rice, mixed salad with spicy one meat item or one seafood item.",Asian,Main,0,1,1,1,0,,2575
153,Grand Seven,Mixed Nasigoreng,"Traditional Indonesian rice dish with beef, chicken, pork.",Indonesian,Main,0,1,1,1,0,,1450
154,Grand Seven,Sea Food Nasigoreng,Traditional Indonesian rice dish with seafood.,Indonesian,Main,0,1,1,1,0,,1400
155,Grand Seven,Sea Food Fried Rice,,Asian,Main,0,1,1,1,0,,1400
156,Grand Seven,Mixed Fried Rice,"Chicken, beef, pork.",Asian,Main,0,1,1,1,0,,1400
157,Grand Seven,Vegetable Fried Rice or Noodles,,Asian,Main,0,1,1,1,0,,1300
158,Grand Seven,Vegetable Chopsuey Rice,,Asian,Main,0,1,1,1,0,,1325
159,Grand Seven,Mixed Chopsuey Rice,"Chicken, beef, pork.",Asian,Main,0,1,1,1,0,,1475
160,Grand Seven,Sea Food Chopsuey Rice,,Asian,Main,0,1,1,1,0,,1500
161,Grand Seven,Chicken Biriyani,,Indian,Main,0,1,1,1,0,,1250
162,Hot Master,Grilled Chicken,Tender grilled chicken served hot,International,Main,0,1,1,0,1,-,1800
163,Hot Master,Grilled Fish,Fresh fish grilled to perfection,International,Main,0,1,1,0,1,-,2000
164,Hot Master,Grilled Prawns,Succulent prawns grilled with seasoning,International,Main,0,1,1,0,1,-,2500
165,Hot Master,Devilled Chicken,Spicy stir-fried chicken with vegetables,Sri Lankan,Main,0,1,1,1,0,-,1500
166,Hot Master,Devilled Fish,Fish stir-fried with spicy sauce,Sri Lankan,Main,0,1,1,1,0,-,1700
167,Hot Master,Devilled Prawns,Prawns stir-fried in hot and spicy sauce,Sri Lankan,Main,0,1,1,1,0,-,2000
168,Hot Master,Hot Battered Cuttlefish,Crispy fried cuttlefish in spicy batter,Sri Lankan,Main,0,1,1,1,0,-,1800
169,Hot Master,Hot Battered Prawns,Prawns coated in spicy batter and deep-fried,Sri Lankan,Main,0,1,1,1,0,-,2200
170,Hot Master,Hot Battered Fish,"Fish fillets in spicy batter, deep-fried",Sri Lankan,Main,0,1,1,1,0,-,1900
172,Hot Master,Hot Battered Chicken,Spicy battered fried chicken pieces,Sri Lankan,Main,0,1,1,1,0,-,1600
173,Hot Master,Spicy Sausages,Sausages cooked with hot spices,International,Side,0,1,1,1,0,-,800
174,Hot Master,Grilled Sausages,Lightly seasoned grilled sausages,International,Side,0,1,1,0,1,-,850
177,Hot Master,Egg Noodles,,Asian,Main,0,1,1,1,0,Regular,1100
181,Hot Master,Seafood Noodles,,Asian,Main,0,1,1,1,0,Regular,1450
185,Hot Master,Sichuan Chicken,,Asian,Main,0,1,1,1,0,Regular,1450
187,Hot Master,Sichuan Seafood,,Asian,Main,0,1,1,1,0,Regular,1550
189,Hot Master,Sichuan Mixed,,Asian,Main,0,1,1,1,0,Regular,1650
191,Hot Master,Nasi Goreng Chicken,,Indonesian,Main,0,1,1,1,0,,1400
192,Hot Master,Nasi Goreng Seafood,,Indonesian,Main,0,1,1,1,0,,1500
193,Hot Master,Nasi Goreng Mixed,,Indonesian,Main,0,1,1,1,0,,1600
194,Hot Master,Vegetable Chop Suey,,Asian,Main,0,1,1,1,0,,2300
195,Hot Master,Seafood Chop Suey,,Asian,Main,0,1,1,1,0,,2850
196,Hot Master,Hot Master Special Mixed Chop Suey,,Asian,Main,0,1,1,1,0,,2950
198,Hot Master,Roasted Chicken Kottu,,Sri Lankan,Main,0,1,1,1,0,Large,1600
199,Hot Master,Seafood Kottu,,Sri Lankan,Main,0,1,1,1,0,Large,1800
200,Hot Master,Hot Master Special Cheese Kottu,,Sri Lankan,Main,0,1,1,1,0,Large,1950
201,Hot Master,Hot Master Mixed Kottu,,Sri Lankan,Main,0,1,1,1,0,Large,2450
202,Hot Master,Hot Master Mixed Cheese Kottu,,Sri Lankan,Main,0,1,1,1,0,Large,2800
203,Hot Master,Steamed Rice,,Asian,Main,0,1,1,1,0,Regular,600
205,Hot Master,Vegetable Fried Rice,,Asian,Main,0,1,1,1,0,Regular,900
207,Hot Master,Egg Fried Rice,,Asian,Main,0,1,1,1,0,Regular,1100
209,Hot Master,Chicken Fried Rice,,Asian,Main,0,1,1,1,0,Regular,1350
211,Hot Master,Seafood Fried Rice,,Asian,Main,0,1,1,1,0,Regular,1450
221,Hot Master,Black Coffee - served with milk,"Hot beverage, medium-strong flavor, served with milk.",International,Beverage,1,1,1,0,1,,450
222,Hot Master,Tea - served with milk,"Hot beverage, light flavor, served with milk.",International,Beverage,1,1,1,0,1,,320
227,Hot Master,Coca Cola,"Cold, sweet carbonated cola drink.",International,Beverage,1,1,1,1,0,300ml,180
232,Hot Master,Vanilla Milkshake,"Cold, creamy, sweet vanilla-flavored milkshake. Extra topping +300.",International,Beverage,1,1,1,1,0,,800
233,Hot Master,Chocolate Milkshake,"Cold, creamy, rich chocolate-flavored milkshake. Extra topping +300.",International,Beverage,1,1,1,1,0,,880
234,Hot Master,Banana Milkshake,"Cold, creamy, sweet banana-flavored milkshake.",International,Beverage,1,1,1,1,0,,800
235,Hot Master,Strawberry Milkshake,"Cold, creamy, sweet strawberry-flavored milkshake.",International,Beverage,1,1,1,1,0,,980
236,Hot Master,Mango Milkshake,"Cold, creamy, sweet mango-flavored milkshake.",International,Beverage,1,1,1,1,0,,950
237,Hot Master,Papaya Milkshake,"Cold, creamy, sweet papaya-flavored milkshake.",International,Beverage,1,1,1,1,0,,850
238,Hot Master,Vegetable soup,"Light, hot vegetable-based soup, served warm, mildly seasoned",International,Starter,1,1,1,0,1,-,550
239,Hot Master,Chicken sweet corn soup,"Hot, thick chicken soup with sweet corn, mildly sweet and savory",Chinese,Starter,1,1,1,0,1,-,850
240,Hot Master,Mixed Salad -with chicken +300,"Fresh mixed vegetables, optionally with chicken, served cold and light",International,Starter,1,1,1,1,0,-,1200
241,Hot Master,Coleslaw salad,Creamy cold salad with shredded cabbage and carrots,International,Starter,1,1,1,1,0,-,900
242,Hot Master,Creamy pasta,"Warm, rich creamy pasta with cheese sauce",Italian,Main,0,1,1,0,1,Regular,950
244,Hot Master,Creamy chicken pasta,Creamy pasta with tender chicken pieces,Italian,Main,0,1,1,0,1,Regular,1300
246,Hot Master,Creamy chicken cheese pasta,Creamy pasta with chicken and extra cheese,Italian,Main,0,1,1,0,1,Regular,1480
248,Hot Master,Creamy seafood cheese pasta,Creamy pasta with seafood and cheese,Italian,Main,0,1,1,0,1,Regular,1600
250,Hot Master,Hot master special nai miris pasta,Spicy pasta with nai miris chili flavor,Italian,Main,0,1,1,0,1,Regular,1700
252,Hot Master,French fries,"Light, crispy fried potato sticks served hot",International,Side,1,1,1,0,1,-,950
253,Hot Master,Fish and chips,"Deep-fried battered fish served with fries, hot and crispy",British,Main,0,1,1,0,1,-,1950
254,Hot Master,Stir fried water spinach with cashew nuts,"Light stir-fried water spinach with crunchy cashew nuts, served hot",Thai,Main,1,1,1,1,0,,750
255,Hot Master,Pineapple fried rice chicken,"Fried rice with pineapple and chicken, savory-sweet flavor, served hot",Thai,Main,0,1,1,1,0,,2300
256,Hot Master,Pineapple fried rice seafood,"Fried rice with pineapple and seafood, savory-sweet flavor, served hot",Thai,Main,0,1,1,1,0,,2700
257,Hot Master,Vanilla ice cream,"Cold, sweet vanilla-flavored ice cream",Western,Dessert,1,1,1,0,1,,400
258,Hot Master,Chocolate ice cream,"Cold, sweet chocolate-flavored ice cream",Western,Dessert,1,1,1,0,1,,440
259,Hot Master,Strawberry ice cream,"Cold, sweet strawberry-flavored ice cream",Western,Dessert,1,1,1,0,1,,440
260,Hot Master,Mango ice cream,"Cold, sweet mango-flavored ice cream",Western,Dessert,1,1,1,0,1,,440
261,Hot Master,Fruit salad with ice cream,"Fresh fruit salad served with ice cream, cold and sweet",Western,Dessert,1,1,1,0,1,,600
262,Hot Master,Banana fritters with honey,Sweet fried banana fritters drizzled with honey,Asian,Dessert,1,1,1,0,1,,480
263,Hot Master,Ice cream tower,"Tall layered ice cream dessert, sweet and cold",Western,Dessert,1,1,1,0,1,,1900
264,Hot Master,Fresh Strawberry with ice cream mania,"Fresh strawberries served with ice cream, sweet and cold",Western,Dessert,1,1,1,0,1,,1800
265,Hot Master,Hot master bartender special,"Fresh mint, lime & sprite",Cuban,Beverage,1,1,1,1,1,,750
266,Hot Master,"Hot master carrot, lime & ginger","Carrot, lime, ginger drink",Asian,Beverage,1,1,1,1,1,,700
267,Hot Master,Hot master mango gimmy,Mango-based drink,International,Beverage,1,1,1,1,1,,950
268,Hot Master,Hot master ice coffee,Iced coffee beverage,International,Beverage,1,1,1,1,1,,800
269,Hot Master,Classic Mojito,Refreshing lime & mint mocktail,Cuban,Beverage,1,1,1,1,1,,850
270,Hot Master,Passion Mojito,"Passion fruit, lime & mint mocktail",Cuban,Beverage,1,1,1,1,1,,900
271,Hot Master,Blackcurrant,Blackcurrant-flavored mocktail,International,Beverage,1,1,1,1,1,,950
272,Hot Master,Lassi - Plain with salt,"Light, savory yogurt-based drink served chilled with a pinch of salt",Indian,Beverage,1,1,1,0,1,-,800
273,Hot Master,Lassi Mango,Sweet mango-flavored yogurt-based drink served chilled,Indian,Beverage,1,1,1,0,1,-,950
274,Hot Master,Lassi Banana,Sweet banana-flavored yogurt-based drink served chilled,Indian,Beverage,1,1,1,0,1,-,850
275,Hot Master,Lassi Papaya,Sweet papaya-flavored yogurt-based drink served chilled,Indian,Beverage,1,1,1,0,1,-,900
277,Hot Master,Fresh Lime Soda,Sparkling soda with lime juice served chilled,International,Beverage,1,1,1,0,1,-,550
278,Hot Master,Fresh Passion Juice,Sweet and tangy passion fruit juice served chilled,International,Beverage,1,1,1,0,1,-,650
279,Hot Master,Fresh Pineapple Juice,Sweet tropical pineapple juice served chilled,International,Beverage,1,1,1,0,1,-,750
280,Hot Master,Fresh Papaya Juice,Sweet papaya juice served chilled,International,Beverage,1,1,1,0,1,-,650
281,Hot Master,Fresh Melon Juice,Light and sweet melon juice served chilled,International,Beverage,1,1,1,0,1,-,650
282,Hot Master,Fresh Banana Juice,Creamy banana juice served chilled,International,Beverage,1,1,1,0,1,-,650
284,Hot Master,Fresh Mango Juice,Sweet tropical mango juice served chilled,International,Beverage,1,1,1,0,1,-,800
285,Layerwarf,Chicken Rice And Curry,Steamed rice served with chicken curry and assorted side dishes,Sri Lankan,Main,0,1,1,1,0,-,1700
286,Layerwarf,Prawn Rice And Curry,Steamed rice served with prawn curry and assorted side dishes,Sri Lankan,Main,0,1,1,1,0,-,1800
287,Layerwarf,Egg Rice And Curry,Steamed rice served with egg curry and assorted side dishes,Sri Lankan,Main,0,1,1,1,0,-,1300
288,Layerwarf,Chicken Curry,Spicy chicken curry prepared with Sri Lankan spices,Sri Lankan,Side Dish,0,1,1,1,0,-,850
289,Layerwarf,Prawn Curry,Spicy prawn curry cooked with coconut milk and spices,Sri Lankan,Side Dish,0,1,1,1,0,-,1100
290,Layerwarf,Egg Curry,Boiled eggs cooked in spiced curry gravy,Sri Lankan,Side Dish,0,1,1,1,0,-,550
291,Layerwarf,Dhal Curry,Yellow lentils cooked in coconut milk and spices,Sri Lankan,Side Dish,0,1,1,1,0,-,280
292,Layerwarf,Vegetable Curry,Mixed vegetables cooked with coconut milk and spices,Sri Lankan,Side Dish,0,1,1,1,0,-,380
293,Layerwarf,Fried Egg,Fried egg cooked in oil,Sri Lankan,Side Dish,1,1,1,1,0,-,250
294,Layerwarf,Boiled Egg,Hard-boiled egg served plain,Sri Lankan,Side Dish,1,1,1,1,0,-,200
295,Layerwarf,Butter Chicken - Hopper Set Menu,Served with lunu miris & seeni sambol,Indian,Main,0,1,1,1,0,-,2000
296,Layerwarf,Jaffna Chicken Curry - Hopper Set Menu,Served with lunu miris & seeni sambol,Sri Lankan,Main,0,1,1,1,0,-,2000
297,Layerwarf,Paneer - Hopper Set Menu,Served with lunu miris & seeni sambol,Indian,Main,0,1,1,1,0,-,1800
298,Layerwarf,Beef Kuruma - Hopper Set Menu,Served with lunu miris & seeni sambol,Indian,Main,0,1,1,1,0,-,2800
299,Layerwarf,Mutton Korma - Hopper Set Menu,Served with lunu miris & seeni sambol,Indian,Main,0,1,1,1,0,-,2900
300,Layerwarf,Extra Hopper,Additional plain hopper,Sri Lankan,Side Dish,1,1,1,1,0,-,280
301,Layerwarf,Extra Egg Hopper,Additional hopper with egg,Sri Lankan,Side Dish,1,1,1,1,0,-,180
302,Layerwarf,Chicken Curry - Add-on for Hopper Set Menu,Spicy chicken curry prepared with Sri Lankan spices,Sri Lankan,Side Dish,0,1,1,1,0,-,850
303,Layerwarf,Dhal Curry - Add-on for Hopper Set Menu,Yellow lentils cooked in coconut milk and spices,Sri Lankan,Side Dish,0,1,1,1,0,-,280
304,Layerwarf,Jaggery Hopper,Sweet hopper made with jaggery,Sri Lankan,Dessert,1,1,1,0,1,-,200
305,Layerwarf,Milk Hopper,Sweet hopper made with milk,Sri Lankan,Dessert,1,1,1,0,1,-,600
306,Layerwarf,Chicken kottu,"Stir-fried shredded roti with chicken, vegetables, and spices, served hot",Sri Lankan,Main,0,1,1,1,0,-,2500
307,Layerwarf,Chicken cheese kottu,"Stir-fried shredded roti with chicken, cheese, vegetables, and spices, served hot",Sri Lankan,Main,0,1,1,1,0,-,2750
308,Layerwarf,Seafood kottu,"Stir-fried shredded roti with mixed seafood, vegetables, and spices, served hot",Sri Lankan,Main,0,1,1,1,0,-,2800
309,Layerwarf,Seafood cheese kottu,"Stir-fried shredded roti with seafood, cheese, vegetables, and spices, served hot",Sri Lankan,Main,0,1,1,1,0,-,2950
310,Layerwarf,Egg kottu,"Stir-fried shredded roti with eggs, vegetables, and spices, served hot",Sri Lankan,Main,0,1,1,1,0,-,1950
311,Layerwarf,Vegetable kottu,"Stir-fried shredded roti with vegetables and spices, served hot",Sri Lankan,Main,0,1,1,1,0,-,1800
314,Layerwarf,Cheese Slice,Slice of cheese served as an add-on,Global,Side dish,1,1,1,0,0,-,300
